{
  "protocolVersion": 1,
  "eventCursor": 42,
  "type": "thread.snapshot",
  "payload": {
    "id": "thread-1",
    "title": "检查构建状态",
    "projectId": "project-1",
    "projectName": "示例项目",
    "source": "desktop",
    "state": "running",
    "updatedAt": "2026-08-25T12:00:00Z",
    "attention": {
      "category": "browser_authorization",
      "site": "github.com",
      "confidence": 0.9,
      "detectedAt": "2026-08-25T12:01:00Z"
    }
  }
}
